OBJECTID,gcp_name,latitude,longitude,ellipsoidheight,state,district,tahsil,BRIEF_DESCRIPTION,old_description,UID,pid,gdc_username
1059,KOT KHAWDA,26.654487,76.085125,253.03491,RAJASTHAN,JAIPUR,CHAKSU,"GCP is situated in an open ground of Gram Panchayat near Govt. Upper Primary School, Kot Khawda","The GCP station is situated in the open ground of Gram Panchayat near Govt. Upper Primary school, Kot Khawda Sub Tehsil- Kot Khawda, tehsil- Chaksu, Distt- Jaipur of state Rajasthan. The SRM fixed with concrete cement on GCP Station. It is about 3m West",911090001,A358RM3,Rajasthan Geo-spatial Directorate
1060,KOTHAGUDA,17.910247,80.057468,193.61292,TELANGANA,WARANGAL,KOTHAGUDA,"GCP is situated in the campus of Veterinary Dispensary, Kothaguda.",Dot marked in punched on cut mark fixed in centre on cemented concrete pillar dimension 55 x 55cm. The GCP pillar is erected at SW corner of veterinary dispensary in (Kothaguda) this is about 25m W to gate and 25m SW to SW corner of building and 28m S to,1805090001,A26V2W3,AndhraPradesh &Telangana Geo-spatial Directorate
1061,KOTHAGUDEM,17.569306,80.625949,31.26027,TELANGANA,KHAMMAM,KOTTAGUDEM,"GCP is situated in the campus of Sr. Govt. Arts & Science Degree College, Kothagudem.","Survey Reference Mark fixed at centre of square cemented platform in the premises of “SR Govt. Arts & Science Degree College” KothagudemMandal-Kottagudem, Distt-Khammam, Andra Pradesh. It is 3m W from W edge of college stage, 30m E from entrance door",1806060001,A26V2HJ,AndhraPradesh &Telangana Geo-spatial Directorate
1062,KOTHI,32.317112,77.19234,2513.83664,HIMACAL PRADESH,KULLU,MANALI,"GCP is situated on the back of Rest House (PWD), Kothi","An Iron rod fixed in the centre of top of cement and concrete pillar of dimension 32cm×32cm×23cm in the campus of PWD Rest house at Kothi, Tehsil-Manali, District-Kullu of Himachal Pradesh. The Rest house is located about 13km north from Manali towards",304010001,A35JV85,"Punjab, Haryana, Himachal Pardesh  & Chandigarh, Geo-spatial Directorate"
1063,KOTSHILA,23.40453,86.071423,243.55988,WEST BENGAL,PURULIA,JHALIDA,"GCP is situated  in the campus of BDO Office, Kotshila","Plus Mark cut on an small circular Iron plate which is fixed on the centre of cemented concrete pillar of size about 1m x 1m and about 20cm above the ground level. The pillar is situated in the primises of BDO Office Jhalda -II at Kotshila, Tehsil- Jhali",1613020001,A3658C3,West Bengal & Sikkim Geo-spatial Directorate
1064,KOTTAVALSA,17.900824,83.189836,-12.16297,ANDHRA PRADESH,VIZIANAGRAM,KOTTAVALSA,"GCP is situated in the campus of Mandal Revenue Office, Kottavalsa.","The GCP station is situated in the campus of MRO Office Kottavalsa,  Mandal Kottavalsa, Distt.- Vizianagram of state A.P.  Circle & cross marked on GCP station. It is about 30m West of MRO Office and about 20m SE of main gate and about 5m East of wall, a",2002060001,A26V5W5,AndhraPradesh &Telangana Geo-spatial Directorate
1065,KOVILLUR,8.510183,77.185118,253.90239,KERALA,TRIVENDRUM,NEYYATTINKARA,"GCP is situated on Amburi Kurisumala, Amburi Village","Circle and dot engraved on the Amburi Kurisumala in Amburi village, taluk Neyyattinkara of  Trivendrum district. The station is about 500m f rom Amburi Panchayat Office building. A metalled road leads from Thattanmukku junction to hill bottom, one foot p",2315030001,A25CVG5,Kerla & Lakshdweep Wing
1066,KOVILNATTAM,11.769461,77.558917,960.48813,TAMIL NADU,ERODE,BHAVANI,"GCP is situated on sheet rock in the campus of Jeeva Ninavivu Tribal Peoples Hospital, Tamarai Karai","Circle and dot mark engraved on sheet rock 150m NW of Tamarai Karai village, Bargur road in Andiyur taluk of Erode district. This village is located on Western Ghats. The station is located in Jeeva Ninaivu Tribal peoples Hospital premises in Tamarai Kar",2409010001,A25HVQH,"Tamilnadu, Pondicherry and Andaman & Nicobar Island Geo-spatial Directorate"
1067,KOYILANDI,11.443207,75.692749,-73.07531,KERALA,KOZHIKODE,KOYILANDI,GCP is situated at NW corner on the terrace of Mini Stadium,"The GCP engraved and painted on the NW corner of top of mini stadium, Koyilandi. The place belongs to Panthalayami village falls in Koyilandi taluk, District- Kozhikode. The Point is on the top of the Pavilion, which is beside the NH-17 route. The Point",2304040001,A25HQCM,Kerla & Lakshdweep Wing
1068,KRISHAN NAGAR,23.276893,83.825457,790.21713,CHATTISGARH,SURGUJA,SONKARGARH,"GCP is situated on the back of Primary School, Krishna Nagar","A dot punched in the centre of a brass plate fixed in the centre of the top of concrete cemented pillar of dimension 1m x 1m and about 18cm above ground level in the back side of the Primary School of Krishan Nagar village, taluka-Sankargarh, District- S",1402040001,A36557R,Odisha & Chhattishgarh Geo-spatial Directorate
1069,KRISHNAGIRI,12.554988,78.199144,426.60167,TAMIL NADU,KRISHNAGIRI,KRISHNAGIRI,"GCP is situated on the North of Collectorate Office, Krishnagiri",Cement concrete pillar of dimension 1mx1mx1.2m constructed at Kallukurikki village. Taluk& District Krishnagiri. It is about 300m N of Krishnagiri Collector Office (back side) about 3m South of square shaped water tank about 75m W of Executive Engineer O,2406020001,A25JWH5,"Tamilnadu, Pondicherry and Andaman & Nicobar Island Geo-spatial Directorate"
1070,KUCHINDA,21.745072,84.349981,180.91266,ODISHA,SAMBALPUR,KUCHINDA,"GCP is situated in the campus of Govt. High School, Kuchinda","Mark on brass plate fixed in the center of  1mx1mx15cm cemented pillar in the campus of Govt. High School at Kuchinda of Tehsil- Kuchinda falls in District – Sambalpur, Odisha. The School is located in the mid of town and East of NH-200. It is near Jai",1905010001,A3636P8,Odisha & Chhattishgarh Geo-spatial Directorate
1071,KUHI,20.990984,79.406792,205.50246,MAHARASHTRA,NAGPUR,KUHI,"GCP is situated in the campus of Zila Parishad Higher Primary School, Chipdi","The GCP pillar constructed with Circular Brass Plate, fixed in a cement concrete pillar of dimension 1m x 1m x 1.25m and 20cm above ground level. It is situated in the campus of Zilla Parishad Higher Primary School, about 150m SW of Shri Hanuman Temple,",1708050001,A352XXC,Maharashtra and Goa Geo-spatial Directorate
1072,KUJANG,20.318315,86.522424,-58.46926,ODISHA,JAGATSINGHPUR,KUJANG,"GCP is situated in the campus of Bana Behari High School, Kujang",SRM is fixed in the centre of 30cm x 30cm in the cemented pillar supported by 1mx1m concrete cemented pillar and about 20 cm above the ground level. The pillar is situated in the campus of Bana Behari High School at Kujang of tehsil Kujang falls in Distr,1922010001,A36288G,Odisha & Chhattishgarh Geo-spatial Directorate
1073,KUKADGAON,18.493387,75.46654,491.61459,MAHARASHTRA,OSMANABAD,PHARENDA,"GCP is situated in an open area near Zila Parishad Primary School, Kukadgaon","The GCP pillar is constructed with Circular Brass Plate,  fixed in a cement concrete pillar of dimension 1m × 1m × 1.25m and about 20 cm above ground level. It is situated in an open area near wire fence of Zilla Parishad Primary School, Kukadgaon, abo",1727010001,A25WQFF,Maharashtra and Goa Geo-spatial Directorate
1074,KUKSHI,22.200989,74.751792,119.10119,MADHYA PRADESH,DHAR,KUKSHI,GCP is situated in the premises of NVDA Office (Jobat Pariyojna),"The Survey reference mark is fixed in the centre of a cemented concrete pillar of size about 1 m x 1 m and about 20 cm above the ground level and situated in the campus of Jobat Pariyojna’ NVDA office, Kukshi. This office  is behind Gaytri colony and n",1332050001,A354P6Q,Madhya Pradesh Geo-spatial Directorate
1075,KULIGAON,26.050803,93.722318,97.63005,ASSAM,KARBI ANGLONG,BOKAJAN,"GCP is situated inside the  P.H.E. Campus, Kuligaon","Survey Reference Mark with “+” mark fixed centrally on the top of cement concrete platform of dimension 1m x 1m and 20m above the ground level. It is located inside PHE campus at Kuligaon,tehsil-Bokajan falls in Karbi-Anglong district. It is about 48",3313020001,A368M3P,Assam & Nagaland and TMMz Geo-Spatial Directorate
1076,KULLU,31.962337,77.121215,1307.58267,HIMACAL PRADESH,KULLU,KULLU,"GCP is situated  on the NE of Govt. Primary School, Dobi Village","Circle and dot mark engraved on a big rock in-situ, 1km East of Kullu across Vyas River at village Dobi, Tehsil-Kullu, District-Kullu of Himachal Pradesh. The station is situated about 150m NE of Govt. Primary School at Dobi about 50 m South of Panchyat",304020001,A35HVX4,"Punjab, Haryana, Himachal Pardesh  & Chandigarh, Geo-spatial Directorate"
1077,KULLURU,14.490845,79.366253,-16.00107,ANDHRA PRADESH,NELLORE,KALUVAYA,"GCP is situated in the campus of Gram Panchayat Office, Kulluru.","Circle and dot engraved on square pillar centrally, dimension is 65cm x 65cm and 13 cm height. The pillar is established in the campus of Gram Panchayat office Premises Kullur village Kaluvaya Mandal, Nellur district of Andra Pradesh. The pillar is erect",2014100001,A25PXF9,AndhraPradesh &Telangana Geo-spatial Directorate
1078,KUMARGHAT,24.188341,92.026917,-13.70487,TRIPURA,NORTH TRIPURA,SAIDABARI,"GCP (Sifted) is situated in the campus of Saidabari Senior Basic School , Saidabari","A circular brass dot punched on the top of  an angle iron ,fixed vertically at the center and flush with the top level of concrete cemented pillar of dimensions about 30cm x 30cm. about 40 cm above from ground level. The GCP pillar situated in the campus",3801020001,A366J52,Assam & Nagaland and TMMz Geo-Spatial Directorate
1079,KUMARGRAM,26.598976,89.826247,25.09284,WEST BENGAL,JALPAIGURI,ALIPUR DUAR,"GCP is situated in the premises of BDO Office, Kumargram","The GCP Phase II Pillar is constructed 30cm x 30cm in the centre of 1mx1m concrete emented pillar, 20 cm above the ground level. The pillar is situated in the campus of Block Development Office. It is SE side of office. The Best approach to this point fr",1602020002,A368FHR,West Bengal & Sikkim Geo-spatial Directorate
1080,KUMTA,14.422123,74.414247,-47.12041,KARNATAKA,UTTAR KANNADA,KUMTA,"GCP is situated in the premises of the Assistant Commissioner & Sub-Divisional Magistrate Office, Kumta","The GCP is situated in the premises of Assistant Commissioner and Sub- Divisional Magistrate office at Kumta, Tehsil-Kumta, District-Uttar Kannada, Karnataka state. It is about 100m South of IB and 22m North of Flag Post, about 56m NW of NE corner of Ass",2212070001,A25PPCC,Karnataka Geo-spatial Directorate
1081,KUNDAHIT,23.973805,87.155265,98.70189,JHARKHAND,JAMTARA,KUNDAHIT,"GCP is situated on the North of Inspection Bunglow, Kundahit Village","Dot & circle engraved and painted with red colour on top of cement concrete pillar of size 30cm x 30cm, about 30cm above ground level North of Inspection Bungalow  (PWD) in Village Kundahit. It is about 10m North of IB and about 60m NE from BDO Office’",1512020002,A3659X5,Jharkhand & Bihar  Geo-spatial Directorate
1082,KURAJ,25.079069,74.095997,445.9453,RAJASTHAN,RAJSAMAND,RAILMAGRA,"GCP is situated at Govt. Senior Secondary School,Kuraj.","A circular Survey reference mark embedded and flushed with the upper surface level of cemented platform of size 1m x 1m x1.2m of which 1m x 1m x 0.2m portion is above ground level and situated in the premises of Govt. Senior Secondary school play ground,",924040001,A357P33,Rajasthan Geo-spatial Directorate
1083,KURAON,24.979043,82.094933,63.88099,UTTAR PRADESH,ALLAHABAD,KURAON,"GCP is situated at village tri-junction pillar, near Baidwari Kalan","The GCP station is situated on tri-junction pillar of village Baidwari Kalan, Ulda and Baidwari, Tehsil: - Kuraon, District: - Allahabad (UP). Circle and dot marked on tri- junction pillar of village Baidwari Kalan, Ulda, Baidwari. It is fixed in the pad",1065050001,A3664X3,Uttar Pradesh Geo-spatial Directorate
1084,KURDEG,22.548641,84.127239,359.04296,JHARKHAND,SIMDEGA,KURDEG,"GCP is situated on the North of Govt. School, Kalijer Village","Dot with Circle  marked & engraved on Sheet-rock near Village Kolijer. It is about 70m East from 1st  Culvert & about 80m SE from 2nd Culvert on road leading to Kolijer, about 60m SE from a mound and about 80m North from Govt. School. The GCP falls in Bl",1522030001,A3646G4,Jharkhand & Bihar  Geo-spatial Directorate
1085,KURINJIPAADI,11.541744,79.598224,-76.81283,TAMIL NADU,CUDDALORE,CUDDALORE,"GCP is situated in Kurinjipaadi Village,near Aayan Kurinjipaadi","Cemented concrete pillar of dimension 1mx1m constructed in village Kurinjipaadi (Near Aayan Kurinjipaadi) (Varadharajan pettai, Narampanthal Kalam) Kurinjipaadi Taluk, Cuddalore district. This place is along the SH-10 connecting Cuddalore and Salem. It i",2911010002,A25HXGH,"Tamilnadu, Pondicherry and Andaman & Nicobar Island Geo-spatial Directorate"
1086,KURNOOL,15.833375,78.037276,199.5352,ANDHRA PRADESH,KURNOOL,KURNOOL,"GCP is situated in the campus of State Guest House Building, Kurnool.",A brass dot punched inside an angle iron firmly fixed in a concrete cemented pillar of dimensions about 0.30m x 0.30m x 0.40m erected on a concrete base of dimensions about 0.8m x 0.8m & about 5cm above ground level. The GPS pillar is situated in the NE,2011030001,A25QWR2,AndhraPradesh &Telangana Geo-spatial Directorate
1087,KURUGODU,15.344156,76.841599,348.52458,KARNATAKA,BELLARY,BELLARY,"GCP is situated in the premises of AEE/IB Board No. 1 Sub-Division LLC Colony, Kurugodu","The GCP is mounted on a pillar of dimension1m x 1m which is situated inside the premises of AEE/IB board No-1 sub division LLC colony at Kurugodu, Tehsil & District-Bellary, Karnataka state. The GCP is situated in SE corner of the park. The pillar is abo",2214020001,A25QR8R,Karnataka Geo-spatial Directorate
1088,KURUKSHETRA,29.966366,76.868308,206.0915,HARYANA,KURUKSHETRA,THANESAR,GCP is situated on a in the premises of Mini Secretariat on SW corner,A circular brass mark punched on the top of an angle iron fixed vertically in the center and flush with the top level of concrete cemented pillar of  dimensions about 30cm x 30cm  and about 50 cm above ground level. GCP Pillar is situated at the SE corne,603020001,A35FRXV,"Punjab, Haryana, Himachal Pardesh  & Chandigarh, Geo-spatial Directorate"
1089,KURUKUNDA,16.178354,76.876774,392.76525,KARNATAKA,RAICHUR,MANVI,"GCP is situated in the premises of Govt. High School, Kurukunda","The GCP station is situated in the premises of Govt. High school at Kurukunda village, Tehsil-Kurukunda, District-Raichur, Karnataka state. It is about 90m SW of Yellamma temple and 32m West of Flag Post which is in front of Govt. School building. It is",2208020001,A25RR5V,Karnataka Geo-spatial Directorate
1090,KUSAMI,23.284091,83.914499,802.10414,CHATTISGARH,SURGUJA,KUSAMI,"GCP is situated in the campus of  Govt. Girls Higher Secondry School, Kusami","Survey Reference Mark fixed with cement concrete pillar of dimension 1mx1mx0.20m. The station is situated in Govt. Girls Higher Secondary School compound at village Kusami, Block- Kusami, District- Sarguja, Chhatisgarh. It is about 3m East of main entran",1402050001,A36557W,Odisha & Chhattishgarh Geo-spatial Directorate
1091,KUSHMANDI,25.53052,88.363527,-23.28075,WEST BENGAL,WEST DINAJPUR,KUSHMANDI,"GCP is situated in the premises of BDO Office, Kushmandi","The GCP Pillar is constructed 30cm x 30 cm in the centre of 1mx1m concrete cemented pillar, 20 cm above the ground level. The pillar is established in the campus of B.D.O office Tehsil- Kushmandi, District- Dinajpur, West Bengal. The station is situated",1606010001,A367CG9,West Bengal & Sikkim Geo-spatial Directorate
1092,KUSUMANCHI,17.220623,79.956851,80.65733,TELANGANA,KHAMMAM,KUSUMANCHI,"GCP is situated in the campus of Tahsildar Office, Kusumanchi.","Circle and dot is engraved on the cemented pillar with dimension 65cm x 66cm and 14cm above the ground level. The Pillar is situated in the campus of  Kusumanchi Tahsildar (M.R.O)office, Kusumanchi Mandal, Khammam district of Andra Pradesh. The pillar is",1806110001,A25VX6X,AndhraPradesh &Telangana Geo-spatial Directorate
1093,KUTTIYADI,11.655024,75.749653,-69.41056,KERALA,KOZHIKODE,WATAKARA,GCP is situated on the terrace of  Kuttiyadi Community Health Centre,"The GCP engraved and painted on the top of the building of Kuttiyadi Community Health Centre (Govt Hospital), Kuttiyadi of taluka- Vatakara, Distt. Kozhikode. The Point is on the top of the West stair case room and middle of terrace portion. It is about",2304020001,A25HQMP,Kerla & Lakshdweep Wing
1094,KVANIDI,9.960033,76.720427,8.30646,KERALA,IDUKKI,THODUPUZHA,"GCP is situated on hill rock near platation Kavale,Kumarmangalam","Circle and dot marked on a hill rock near Plantation Kavale, Kumaramangalam in Thodupuzha taluk, district - Idukki. The huge rock is known as Nedumpara. The GCP is about 25m East of a two small temporary huts on the rock, one water tank is on the West si",2310030001,A25FRXP,Kerla & Lakshdweep Wing
1095,KYELANG,32.56172,77.071526,3187.13239,HIMACAL PRADESH,LAHUL & SPITI,KYELANG,"GCP is situated on the West of Army Communication Post, Stingiri Village","A circle and dot punched on the top of iron plate of dimension 10cm x 10cm which is fixed on the top of cemented pillar of dimension 30cmx30cmx30cm. It is situated in village Stingiri, Tehsil-Kyelang, District-Lahul & Spiti, State-Himachal Pradesh.It is",302010003,A35JVH3,"Punjab, Haryana, Himachal Pardesh  & Chandigarh, Geo-spatial Directorate"
1096,LABHA,27.087521,88.658842,2068.53197,WEST BENGAL,DARJILING,KALIMPANG,"GCP is situated  in the campus of Dak Bunglow (Forest), Labha","The GCP Phase II Pillar is constructed 30cmx30 cm in the centre of 1m x1m concrete cemented pillar, 20 cm above the ground level. The pillar is established in the campus of Forest Bungalow Labha, Tehsil- Kalimpang, District- Darjiling. It is South West s",1601010001,A369C3M,West Bengal & Sikkim Geo-spatial Directorate
1097,LABHPUR,23.809256,87.797165,-15.34691,WEST BENGAL,BIRBHUM,BOLPUR,"GCP is situated in the campus of BDO Office, Labhpur","The GCP Phase II Pillar is constructed  30cm x 30 cm square, in the centre of 1m x1m concrete cemented pillar, 20 cm above the ground level. The pillar is established in the campus B.D.O office compound, Tehsil- Labhpur, District- Birbhum. The pillar is",1610030001,A3659RQ,West Bengal & Sikkim Geo-spatial Directorate
1098,LADNUN (BHIYANI),27.657081,74.422563,269.65767,RAJASTHAN,NAGAUR,LADNUN,"GCP is situated at Govt. Primary School, Bhiyani.","Survey Reference Mark   is embedded and flush with the upper surface level of cemented platform of size 1m x 1m x0.2m  situated in the premises of Govt. Primary School, Bhiyani, tehsil- Ladnun,Distt.- Nagaur. GCP pillar is about 3m NW from main gate of s",910010001,A359PMC,Rajasthan Geo-spatial Directorate
1099,LAGAM,19.542041,79.904278,84.30028,MAHARASHTRA,GADCHIROLI,MULCHERA,GCP is situated opp. Km. Stone No. 235/2 on Chandrapur-Sironcha Road,The observation is taken on the center of iron plate  which is firmly fixed in the center cemented concrete pillar of size 65cm x 65cm and about 20cm above the Ground Level. It is in the NW corner of ADIVASI SAHAKARI SAMSTHA LTD – Lagam Office. It is a,1717020001,A25XXGW,Maharashtra and Goa Geo-spatial Directorate
1100,LAHA,9.361731,76.909966,311.09577,KERALA,PATHANAMTHITTA,RANNI,"GCP is situated in the helipad ground,  Harison Malayalam Co. Ltd., Laha","Circle and dot engraved on the brass plate inside a concrete platform which is situated in the helipad ground of Harrison Malayalam Company Ltd., Laha, taluka- Ranni, Distt.-Pathanamthita. It is also called Laha Estate. The station is about 1km from Mana",2313010001,A25FR9W,Kerla & Lakshdweep Wing
1101,LAHORIGHAT,26.421022,92.324394,7.19221,ASSAM,MORIGAON,LAHORIGHAT,"GCP is situated inside in the campus of Circle Office, Lahorighat","Force centering device (FCD) with ‘+’ mark fixed centrally on the top of cement concrete platform of dimension 1m x 1m and 20m high above the ground level. It is located inside Circle Officer office campus, exactly on the North of its campus at Lahor",3315010001,A368JC8,Assam & Nagaland and TMMz Geo-Spatial Directorate
1102,LAHORIJAN,25.928899,93.732877,92.02412,ASSAM,KARBI ANGLONG,DIPHU,"GCP is situated in the premises of Inspection Bunglow (PWD), Lahorijan","The Survey reference mark is fixed in the centre of a cemented concrete pillar of size about 1 m x 1 m and about 50 cm above the ground level. The pillar is established inside the premises of PWD Inspection Banglow,  LAHORIJAN, Tehsil - Diphu and Distric",3313030001,A367MWP,Assam & Nagaland and TMMz Geo-Spatial Directorate
1103,LAKHANDUR,20.76197,79.881674,163.08589,MAHARASHTRA,BHANDARA,LAKHANDUR,GCP is situated in the Campus of Executive Engineer Office/Rest House (PWD),"The GCP pillar is constructed with Circular Brass Plate, fixed in a cement concrete pillar of dimension 1m x 1m x 1.25m and 25 cm above ground level. It is situated in the campus of PWD Govt. Rest House/ Executive Engineer Office, Lakhandur, about 2 km N",1709040001,A352XQV,Maharashtra and Goa Geo-spatial Directorate
1104,LAKHANPUR,21.756326,83.775368,146.39604,ODISHA,JHARSUGUDA,LAKHANPUR,"GCP is situated in the campus of Govt.High School & U.P. School, Lakhanpur","mark on brass plate fixed in the centre of cemented pillar of size 1mx1mx0.15m in the campus of Govt.High School and Upper Primary school at Lakhanpur tehsil- Lakhanpur, District Jharsuguda of Odisha. It is about 20m West of Upper primary school and abou",1904020001,A3635QQ,Odisha & Chhattishgarh Geo-spatial Directorate
1105,LAKHIMPUR,27.935538,80.7755,82.2874,UTTAR PRADESH,LAKHIMPUR,LAKHIMPUR,"GCP is situated in the campus of PWD Godown, Lakhimpur","A small circular brass dot punched in an iron angle, fixed vertically in the center of a concrete cemented pillar at dimensions about 30 cm x 30 cm and about 50 cm above ground level. The GCP pillar is situated in the campus of Gowdown of P.W.D. in Lakhi",1017010001,A3692WQ,Uttar Pradesh Geo-spatial Directorate
1106,LAKHISARAI (HASANPUR),25.148924,86.105462,-14.06489,BIHAR,LAKHISARAI,LAKHISARAI,GCP is situated at on Sheet Rock near road leading to Munger from Hasanpur,"A dot and circle engraved and painted in red on Sheet Rock West of road leading from Hasanpur Village ( Lakhisarai ) to Munger. It is situated on the Sheet Rock, about 20 m West from West Bank of  Kiul River, about 15 m East from Pipal Tree ( Hanuman Wor",1126010001,A367844,Jharkhand & Bihar  Geo-spatial Directorate
1107,LAKHNI,24.30778,71.822016,31.0987,GUJARAT,BANASKANTHA,DISA,"GCP is situated in the premises of Shri Lakhni Pay Centre School, Lakhni","Survey Reference Mark (SRM) is fixed with cement concrete pillar of dimension 1m x 1m x 1.2m and about 20cm above ground level situated in the compound of Shri Lakhni Pay Centre School at Lakhni.taluk-Disa, District-Banaskantha, Gujarat. It is about 1.5m",1203040001,A356H8R,Gujarat Daman & Diu Geo-spatial Directorate
1108,LAKKIREDDIPALLE,14.184497,78.701778,273.79101,ANDHRA PRADESH,KADAPA,LAKKIREDDIPALLE,"GCP is situated in the campus of Mandal Office, Lakkireddipalle.","Mark engraved at the centre of cement & concrete pillar of dimension 56cm x 56cm. The pillar is 13cm above ground level. The pillar is situated in the campus of Mandal Office Lakkireddipalle, Mandal-Lakkireddipalle, District-Kadapa (A.P). It is 1.5m Sout",2013140001,A25PW5P,AndhraPradesh &Telangana Geo-spatial Directorate
1109,LALGANJ,25.859786,85.180034,-14.31512,BIHAR,VAISHALI,LALGANG,GCP is situated in the premises of Inspection Bunglow ( Irrigation Department ),"The pillar is situated on the NE corner of the I.B Jal Sanshadan Vibhag (Irrigation Department) Lalganj.  Block & Tehsil Lalganj, District Vaishali of Bihar State.",1116010001,A3677V5,Jharkhand & Bihar  Geo-spatial Directorate
1110,LALGARH,26.138656,80.910985,50.1543,UTTAR PRADESH,RAI BAREILLY,LALGANJ,"GCP is situated in the campus of Nehru Inter College, Vishnu Khera Village",The Survey reference mark is fixed in the centre of the 30cmx30cm RCC pillar. This pillar is 0.20cm above the ground level. This RCC pillar is fixed at the centre of 1mx1mt brick masonary platform. The GCP pillar is established in the campus of Shri Nehr,1047020001,A36824W,Uttar Pradesh Geo-spatial Directorate
1111,LALITPUR,24.693047,78.407458,305.49515,UTTAR PRADESH,LALITPUR,LALITPUR,"GCP is situated in the campus of District Magistrate Office, Lalitpur","A small circular brass dot punched in an iron angle, fixed vertically in the center of a concrete cemented pillar at dimensions about 30 cm x 30 cm and about 50 cm above ground level. The GCP pillar is situated in the campus of District Magistrate Office",1069020001,A356WMC,Uttar Pradesh Geo-spatial Directorate
1112,LALPUR,22.190733,69.960482,17.35822,GUJARAT,JAMNAGAR,LALPUR,"GCP is situated in the premises of Municipal High School, Lalpur","Survey Reference Mark (SRM) is fixed with cement concrete pillar of dimension 1m x 1m x 1.2m and about 45cm above ground level situated in the compound of Municipal High School, Lalpur taluka- Lalpur of Jamnagar district, Gujarat. It is about 6m EES of m",1209060001,A354F5X,Gujarat Daman & Diu Geo-spatial Directorate
1113,LALUK,27.116955,93.933677,35.35409,ASSAM,LAKHIMPUR,BIHPURIA,"GCP is situated in the campus of Govt. Higher Secondary School, Laluk","The Survey reference mark is fixed in the centre of a cemented concrete pillar of size about 1 m x 1 m and about 20 cm above the ground level. The GCP pillar is situated in the campus of Government Higher secondary school at LALUK, tehsil - Bihpuria, Sub",3304030001,A369M4W,Assam & Nagaland and TMMz Geo-Spatial Directorate
