OBJECTID,gcp_name,latitude,longitude,ellipsoidheight,state,district,tahsil,BRIEF_DESCRIPTION,old_description,UID,pid,gdc_username
1,23 KILO,23.730144,92.035747,118.56027,TRIPURA,DHALAI,CHHAMANU,"GCP is situated at tri-junction of roads Chowmanu, 32 Kilo & Thalchera","Red Mark dot placed on the nail on a small pillar closed to water tap post on the trijunction of Chowmanu, 32 Kilo and Thalchera, Tehsil - Chhamanu and District – Dhalai, TRIPURA. This pillar is found destroyed, hence a big nail or Bolt type big nail i",3802020001,A365JP2,Assam & Nagaland and TMMz Geo-Spatial Directorate
2,3 B CHHOTI,29.944508,73.816129,127.55164,RAJASTHAN,GANGANAGAR,GANGANAGAR,"GCP is situated in the campus of Govt. Girls Upper Primary School, 3B Chhoti","The GCP station is situated in the campus of Govt. Girls Upper Primary school, 3B Chhoti village, tehsil and Distt- Sri Ganga Nagar of state Rajasthan. Mark on GCP station. It is about 25m North of school kitchen and about 15m SE of main gate and about 4",901010001,A35FMWR,Rajasthan Geo-spatial Directorate
3,9 DWD (GULAM ALI WALA),28.581326,72.326327,73.19384,RAJASTHAN,BIKANER,KHAJUWALA,"GCP is situated in the campus of Govt. Primary School, (Gulam Ali Wala Panchayat Samiti), Anandgarh","The GCP station is situated in the campus of Govt. Primary School 9D WD / Gulam Ali Wala Panchayat Samiti, Anandgarh, tehsil- Beriyanwala, Distt- Bikaner of state Rajasthan. Mark on GCP station is about 35m West of school, about 30m North of culvert on r",904020001,A35CJH8,Rajasthan Geo-spatial Directorate
4,A.KONDURU,16.959466,80.647877,23.83435,ANDHRA PRADESH,KRISHNA,ATTAPROGADAR KONDURU,"GCP is situated in the campus of Tahsildar Office (MRO), A.Konduru.","Mark on the brass plate which is fixed in the centre of cemented pillar of dimension 67cm x 67cm And about 15cm above ground level. The pillar is constructed in the campus of Attaprogadar konduru Tehsildar (MRO) office, A.Konduru Mandal, Distt.-Krishna,",2008020001,A26R2XJ,AndhraPradesh &Telangana Geo-spatial Directorate
5,A.L.PURAM (KRISHNADEVIPETA),17.670613,82.379851,89.68333,ANDHRA PRADESH,VISAKHAPATNAM,GOLUGONDA,"GCP is situated in the campus of Zila Parishad High School, A.L.Puram.","The GCP is circular brass plate of G&RB, which is fixed on a cemented pillar of dimension 51cm x 51cm and 13cm above the ground level. The pillar is constructed N side of the premises of Zilla Parishad High School, Agency Lakshmi Puram (A.L.Puram) (Krish",2003100001,A26V4M9,AndhraPradesh &Telangana Geo-spatial Directorate
6,A.PALLIPATTI,11.91552,78.391731,334.59575,TAMIL NADU,DHARMAPURI,PAPIREDDIPATTI,"GCP is situated in cultivation field, Kottamedu Village","Survey Reference Mark is embedded in the centre of 30cmx30 cm pillar of 1mx1m concrete cemented pillar which is 20cm above the ground level. This pillar is established in the cultivation field in village Kottaimedu,A.Pallipatti of Harur Taluk in District",2407040001,A25HWW9,"Tamilnadu, Pondicherry and Andaman & Nicobar Island Geo-spatial Directorate"
7,ABIRAMAM,9.441239,78.431484,-56.12604,TAMIL NADU,RAMANATHAPURAM,KAMUDI,"GCP is situated in the premises of Inspector Office (Revenue), Abiramam","A cement concrete pillar was laid in the place of revenue inspector’s Office premises in Abiramam village, Kamudi Taluk of Ramanathapuram District in Tamil Nadu. This village is located in SH-47 which is connecting Parthibanur-Kamudi. This station is a",2929020001,A25FWCC,"Tamilnadu, Pondicherry and Andaman & Nicobar Island Geo-spatial Directorate"
8,ABOHAR,30.174025,74.135393,140.24795,PUNJAB,FIROZPUR,ABOHAR,"GCP, a village tri-junction pillar belongs to Latkhanwali Dhani, Kalyani & Churiwali","Circle and dot mark engraved and painted in red colour on the trijunction pillar of three villages namely Latkhanwali Dhani, Kalyani and Churiwali. The pillar is of size about 45cm x 45cm, about 30cm above ground level. An iron rod is fixed centrally wit",409040001,A35GP54,"Punjab, Haryana, Himachal Pardesh  & Chandigarh, Geo-spatial Directorate"
9,ABRAN,33.692719,76.58105,3729.08605,LADAKH,KARGIL,ZANSKAR,"GCP is situated in the premises of Govt. Rest House (PWD), Abran Village","The Survey Reference Mark (SRM), fixed at the centre of cement concrete pillar of dimension 30cm x 30cm and about 20cm above ground level. It is situated in the premises of Govt. Rest House (PWD), Abran Village. It is about 10m SE from SE corner of Rest",102010008,A35MRMH,Jammu & Kashmir and Ladakh Geo-spatial Directorate
10,ACHALPUR,21.246107,77.513079,296.78526,MAHARASHTRA,AMRAWATI,ACHALPUR,"GCP is situated on land having Survey No. 140, Khaltapmali","The GCP pillar is constructed with circular brass plate, fixed in a cement concrete pillar of dimension 1m x 1m and about 20cm above ground level. It is constructed on the land having Survey No. 140 of Khaltapmali, about 25m West of Akola-Achalpur road,",1706030001,A353V6G,Maharashtra and Goa Geo-spatial Directorate
11,ACHAMPET,16.399809,78.635581,384.12965,TELANGANA,MAHABUBNAGAR,ACHAMPET,"GCP is situated in the campus of Tahsildar Office, Achampet.","Circle and dot engraved on the cemented pillar with dimensions 64cm × 64cm and 13cm above from ground level. It is situated in the premises of Tahsildar (MRO) office of Achampet, Mandal – Achampet, District- Mahbubnagar (A.P). The pillar is about 1m S",1809100001,A25RW9J,AndhraPradesh &Telangana Geo-spatial Directorate
12,ACHANKOVIL,9.084835,77.124433,69.56419,KERALA,KOLLAM,PATTANAPURAM,GCP is situated  on a rock at Achankovil Ariyankavu Village,"The GCP is situated on the rock at Achankovil, Ariyankavu village, taluka-Pattanapuram, Distt.-Kollam. The station can be approached from Achankovil temple to Moonnumukku junction. Moonumukku road junction which is leading upto station. The station is ab",2314020001,A25FV34,Kerla & Lakshdweep Wing
13,ACHCHAMPETA,16.62763,80.122872,-41.4122,ANDHRA PRADESH,GUNTUR,ACHCHAMPETA,"GCP is situated in the campus of Tahsildar Office, Achchampeta.","Mark engraved at the centre of cement & concrete pillar of dimension 66cm x 66cm.  The pillar is 13 cm above ground level. The pillar is situated at the NW corner, in the campus of Tehsildar Office, Achchampeta, Taluk- Achchampeta, District-Guntur (AP).",2009010001,A26R2J4,AndhraPradesh &Telangana Geo-spatial Directorate
14,ADAMPUR,29.319172,75.456069,159.88971,HARYANA,HISAR,ADAMPUR,GCP is situated on a Stone pillar marked with 303/3,Circle and dot engraved and painted in red colour on the top of a stone pillar of dimensions about 30cm x 30cm and about 30cm above ground level.  A No.303/3 is engraved on the South face of the stone pillar. The stone pillar is situated at South of Panc,608020001,A35FQ8F,"Punjab, Haryana, Himachal Pardesh  & Chandigarh, Geo-spatial Directorate"
15,ADANKI,15.805843,79.975689,-43.78206,ANDHRA PRADESH,PRAKASAM,ADANKI,"GCP is situated in the campus of Talluk Office, Adanki.","Dot engraved on top of cemented pillar size 63cm x 63cm x 8cm above ground level in the compound of Taluk Office, Taluk- Adanki, Disst.-Prakasam (A.P). The station is about 25m. NE of NE corner of Taluk building, about 8m. S of E gate pillar, about 20m.",2010080001,A25QXRX,AndhraPradesh &Telangana Geo-spatial Directorate
16,ADAVAD,21.221446,75.448338,133.84663,MAHARASHTRA,JALGAON,CHOPDA,"GCP is situated in the campus of Zila Parishad Prathmic (Boys) School, Adavad","marked on brass plate fixed in a cement concrete pillar in the campus of Z.P Prathmic Boys School, Adavad, Taluka Chopda, District Sub-Division Amalner, District Jalgaon of Maharashtra State. The pillar is situated on field bund in Agriculture land, No",1703010001,A353Q6C,Maharashtra and Goa Geo-spatial Directorate
17,ADILABAD,19.665431,78.525453,198.4613,TELANGANA,ADILABAD,ADILABAD,"GCP is situated in the campus of DC Office, Adilabad.",Dot marked punched an on iron plate fixed cut mark centre of cemented concrete pillar dimension 25cm x 25cm.  The GCP Monument A brass dot punched inside an angle iron firmly fixed in a cemented concrete pillar dimension about 0.30m x 0.45m which s slant,1801020001,A25XWMG,AndhraPradesh &Telangana Geo-spatial Directorate
18,ADULABAZAR,20.948391,77.203686,209.91684,MAHARASHTRA,AMRAVATI,DARYAPUR,"GCP is situated in an open land, known as GAYRAN, Adulabazar","The GCP is constructed with circular brass plate, fixed in a cement concrete pillar of dimension 1m × 1m,  about 20 cm above ground level. It is situated in an open area locally known as ‘GAYRAN’ at Adulabazar, about 50m East of nala junction, about",1706050001,A352VW6,Maharashtra and Goa Geo-spatial Directorate
19,ADUR,9.118643,76.709731,10.70448,KERALA,PATHANAMTHITTA,ADUR,"GCP is situated on the top of Nedumkunnu Mala, Adur","The GCP is marked on a brass plate on cemented platform on the top of the Nedumkunnumala top in Adur taluk, district.-Pathanamthitta. The Nedumkunnumala top is 5km away from Adur and 13km away from Bharanikkavu. It is 2 km South of Chakkimukku. The Hill",2313020001,A25FR4P,Kerla & Lakshdweep Wing
20,ADURU,12.551741,75.247366,9.32421,KERALA,KASARGOD,KASARGOD,GCP is situated  in the premises of Govt. High Secondary School,"Survey Reference Mark embedded on a cemented pillar, 20cm elevated above the ground level and it is in the premises of Govt. Higher Secondary school ground ,Aduru village, taluk- Kasargod in district-Kasargod. It is about 5m West from electric pole, 16m",2301010001,A25JQH6,Kerla & Lakshdweep Wing
21,AGAR,23.717213,76.022042,457.19523,MADHYA PRADESH,SHAJAPUR,AGAR,GCP is situated in the premises of Nehru College (New),"Survey reference mark fixed at the centre of 30cm x 30cm RCC pillar.  This pillar is protected by 1m x 1m bricks masonry platform about 20cm above from ground level. The GCP pillar is situated in the campus of New Nehru college, Agar falls in tehsil - Ag",1320010001,A355RP2,Madhya Pradesh Geo-spatial Directorate
22,AGARPADA,21.203875,86.376133,-24.45985,ODISHA,BHADRAK,AGARPADA,"GCP is situated in the campus of K.C.Vidhya Mandir High School, Agarpada.","The GCP station is situated in the campus of K.C. Vidhya Mandir High School Agarpada,Tehsil- Agarpada falls in District- Bhadrak of state Odisha. Mark on GCP station It is about 60m SW of main gate and about 10m East of JRC block and about 1m North of ga",1913010001,A363869,Odisha & Chhattishgarh Geo-spatial Directorate
23,AGARTALA,23.814072,91.247447,-33.54675,TRIPURA,WEST TRIPURA,AGARTALA,"GCP is situated in the premises of Regional Survey Training Institute, A.D. Nagar, Agartala","The Survey reference mark is fixed in the centre of a concrete cemented pillar of size about 1 m x 1 m and about 20 cm above the ground level. The station is established inside the premises of Regional Survey Training Institute (RSTI), A.D. Nagar, Tehsil",3804010001,A365HR6,Assam & Nagaland and TMMz Geo-Spatial Directorate
24,AGIA,26.087027,90.558784,-9.81212,ASSAM,GOALPARA,BALIJANA,"GCP is situated in premises of BDO Office, Agia","A Survey reference mark is fixed in the centre of concrete cemented pillar of size 1 m x 1 m and about 20 cm above the ground level. The pillar is situated SE corner of the RH, in Premises BDO Office at Agia,.The GCP site is 50m South of the Balijana BDO",3322010001,A368G3H,Assam & Nagaland and TMMz Geo-Spatial Directorate
25,AGIAON,25.382259,84.609381,5.69498,BIHAR,BHOJPUR,AGIAON,"GCP is situated in the open compound of BDO Office, Agiaon","marked on Survey Reference Mark, which is fixed at the centre of cement concrete pillar of dimension about 1m x 1m and about 20cm above  ground level. The pillar is situated in the open compound of BDO office (Near Irrigation Office), Agiaon, Village Agi",1119010001,A36769J,Jharkhand & Bihar  Geo-spatial Directorate
26,AGNAU,28.098995,72.778933,134.44397,RAJASTHAN,BIKANER,KOLAYAT,"GCP is situated in the campus of Govt. Boys Middle School, Agnau","The GCP station is situated in the campus of Govt. Boys Middle School Agnau, Tehsil- Kolayat and Distt- Bikaner of state Rajasthan. Mark on GCP station. It is about 30m North of track (village) and about 20m SE of school about 8m NE of compound wall corn",904070002,A35CJ3Q,Rajasthan Geo-spatial Directorate
27,AGOMONI,26.1983,89.783816,-17.64303,ASSAM,DHUBRI,GOLAKGANJ,"GCP is situated in the premises of Inspection Bunglow (National Highways),Aagomoni","A Survey reference mark fixed in the centre of a concrete cemented pillar of size about 1 m x 1 m and about 20 cm above the ground level. The GCP pillar is located inside the premises of IB (National Highway) at Agomoni, tehsil -  Golakganj and district",3320010001,A368F5Q,Assam & Nagaland and TMMz Geo-Spatial Directorate
28,AHMEDNAGAR,19.038071,74.651856,638.876,MAHARASHTRA,AHMEDNAGAR,AHMEDNAGAR,GCP is situated in the campus of Agriculture Research Station 'Chas',"A brass dot punched on the top of  an  angle  iron, fixed at the center of a concrete cemented pillar of dimensions about 30 cm x 30 cm and about 50cm above ground level. It is situated in the Campus of Agriculture Research Station 'Chas' (Ahmednagar), a",1719100001,A25XP2M,Maharashtra and Goa Geo-spatial Directorate
29,AHMEDPUR,18.720168,76.948949,465.31367,MAHARASHTRA,LATUR,UDGIR,GCP is situated on the West of Rokdoba Devsthan (Temple),"Circle & dot marked on covered tank, located on small top on the West of road leading to Nanded (73km). It is about 50m West of Temple named ‘ROKDOBA DEVSTHAN’, about 50m NW of distance stone No.554 on Nanded-Ahmedpur road. The station falls in Tehsi",1726010001,A25WRPW,Maharashtra and Goa Geo-spatial Directorate
30,AHWA,20.753374,73.689988,443.30549,GUJARAT,DANG,AHWA,"GCP is situated in the campus of Circuit House, Ahwa","Survey Reference Mark (SRM) is fixed with cement concrete pillar of dimension 1mx1mx1.2m and about 0.05m above the level in the compound of Circuit House R&B at Ahwa, taluka- Ahwa District -Dang of Gujarat. The Circuit house is situated about 1km East fr",1227010002,A352MQM,Gujarat Daman & Diu Geo-spatial Directorate
31,AIZAWAL,23.732942,92.667094,797.519,MIZORAM,AIZAWAL,THING SULTHLIAH,GCP is situated in the campus of Mizoram University,"A circular brass dot punched on the top of  an angle iron ,fixed vertically at the center and flush with the top level of concrete cemented pillar of dimensions about 30cm x 30cm and about 40 cm above from ground level. The GCP pillar is situated in the",3702010001,A365JPM,Assam & Nagaland and TMMz Geo-Spatial Directorate
32,AJARA,16.127348,74.207029,575.12426,MAHARASHTRA,KOLHAPUR,AJRA,GCP is situated in the campus of Rest House (PWD),"The GCP pillar is constructed with circular brass plate, fixed in a cement concrete pillar of dimension 1m x 1m and 20cm above ground level. It is situated in the campus of PWD Rest House, Ajara, about 35m NE from Rest House,  about 12 m South of Mahadev",1732050001,A25RP46,Maharashtra and Goa Geo-spatial Directorate
33,AJMALKHERA (22 MD CHAK),29.040331,72.991432,99.36442,RAJASTHAN,GANGANAGAR,GARSANA,"GCP is situated in the campus of Govt. Secondary School, Ajmalkhera (22 MD Chak)","The circular Survey Reference mark is established in the campus of Govt. Middle School 22MD Chak,tehsil-Garsana of district-Sri Ganganagar. The Reference mark is fixed in the centre of cemented concrete pillar of dimension 1m x 1m and 20cm above ground l",901080001,A35FJ2X,Rajasthan Geo-spatial Directorate
34,AJNALA,31.834751,74.775098,182.83098,PUNJAB,AMRITSAR,AJNALA,"GCP, a village tri-junction pillar belongs to Ajnala, Gujja Pir & Putch","Circle and dot mark engraved on a stone pillar flush with ground level. It is a village trijunction pillar of Ajnala, Gujja Pir and Palch village falls in Tehsil - Ajnala, District- Amritsar of Punjab state. Best approach to reach the trijunction pillar",402010001,A35HPRQ,"Punjab, Haryana, Himachal Pardesh  & Chandigarh, Geo-spatial Directorate"
35,AKALKOT,17.515793,76.217922,375.52604,MAHARASHTRA,SOLAPUR,AKALKOT,GCP is situated in the campus of Sub Divisional Office (Irrigation),"Survey Reference Mark is fixed at the middle of cement concrete pillar, situated in the Campus of Sub Divisional Officer Minar Irrigation Rural Works, Sub Division Akkalkot on road leading from Akkalkot to Maindargi. It is about 35m South of entrance gat",1730090001,A25VRG6,Maharashtra and Goa Geo-spatial Directorate
36,AKALWALA (AKAL KA TALA),27.825891,71.752777,82.70728,RAJASTHAN,JAISALMER,POKHARAN,"GCP is situated in the compound of Govt Primary School (Rajkiya Prathamic Vidhyalaya, Akalwala","A Survey reference mark is fixed with cement concrete pillar of dimension 1m x 1m x 1.2m in the compound of Rajkiya Prathmic vidyalaya (Govt. Primary school), Akalwala (Akal ka tala) village in sub tehsil-Nachana, taluka / tehsil- Pokran, district.- Jais",908020001,A359HRQ,Rajasthan Geo-spatial Directorate
37,AKASAPUR,19.755959,79.624502,118.00652,MAHARASHTRA,CHANDRAPUR,GONDPIPRI,"GCP is situated in the premises of Panchyat Office, Akasapur","The GCP pillar is constructed with circular brass plate, fixed in a cement concrete pillar of dimension 1 m x 1 m and 20 cm above ground level, situated in the Campus of Grampanchayat Office, Akasapur. It is about 10 m North of Grampanchayat Office, abou",1716070001,A25XXQJ,Maharashtra and Goa Geo-spatial Directorate
38,AKBARPUR,26.436652,82.592211,21.54105,UTTAR PRADESH,AMBEDKAR NAGAR,AKBARPUR,GCP is situated at village tri-junction pillar located near Khidarpur village,The tri junction pillar divides the three villages 1) Afzalpur 2) Rukrudinpur 3) Dayadhi Mybrallpur. The pillar is located in field bunds 500m. S of Khidarpur village where Khidarpur village is located on Akbarpur. Azamgarh state highway. It is 7km. from,1050020001,A3684CH,Uttar Pradesh Geo-spatial Directorate
39,AKHEGWO,25.716343,94.68623,1122.22613,NAGALAND,PHEK,MELURI,"GCP is situated in the premises of ARPO Community Center, Akhegwo","The Survey reference mark is fixed in the centre of a cemented concrete pillar of size about 1 m x 1 m and about 20 cm above the ground level. The GCP Pillar is located in the ground of ARPO Community Center at Akhegwo, Tehsil - Meluri and District – P",3407010001,A367PPM,Assam & Nagaland and TMMz Geo-Spatial Directorate
40,AKLERA,24.41552,76.565426,266.30629,RAJASTHAN,JHALAWAR,AKLERA,"GCP is situated in the campus of Govt. Office (PWD), Aklera","A circular brass dot punched on the top of an angle iron, fixed vertically in the centre and flush  with  the top  level of concrete cemented pillar of dimensions about 30 cm x 30 cm. and about 50 cm above from ground level. The GCP Library pillar is sit",929030001,A356RCH,Rajasthan Geo-spatial Directorate
41,AKOLA,20.706907,77.03776,233.3352,MAHARASHTRA,AKOLA,AKOLA,GCP is situated in the campus of Dr. Panjabrao Desmukh Krishi Vidhyapeeth Akola,"A brass dot punched on the top of  an  angle  iron, fixed at the center of a concrete cemented pillar of dimensions about 30 cm x 30 cm and about 50cm above ground level. The GCP pillar is situated in the campus of Dr. Panjabrao Desmukh Krishi Vidyapeeth",1705040001,A352VP2,Maharashtra and Goa Geo-spatial Directorate
42,AKOLA BAZAR,20.16426,78.142463,216.02126,MAHARASHTRA,YAVATMAL,YAVATMAL,GCP is situated in the premises of  Primary Health Centre,"The GCP Pillar constructed with circular brass plate, fixed in a cement concrete pillar of dimension 1m x 1m and 25 cm above ground level. It is situated inside on the SE of  Primary Health Centre Campus, Akola Bazar, Village & PO Akola Bazar. It is abou",1715010002,A352W54,Maharashtra and Goa Geo-spatial Directorate
43,ALAMPARAI,12.268025,80.012507,-88.20697,TAMIL NADU,KANCHIPURAM,CHEYUR,"GCP is situated on an old cemented grave platform near Alamparai Fort, Alamparai","Circle & dot engraved and painted in green as SOI PGCPII in the NW corner of a old cemented grave platform, near Alamparai fort,Tehsil- Cheyur, District- Kanchipuram. It is about 50m East of metalled road connecting Kadapakkam and Alamparai fort, about 5",2404040002,A26J272,"Tamilnadu, Pondicherry and Andaman & Nicobar Island Geo-spatial Directorate"
44,ALAMPUR,15.881689,78.124674,196.92668,TELANGANA,MAHABUBNAGAR,ALAMPUR,"GCP is situated in the campus of R&B Guest House, Alampur.","The GCP pillar circle and dot engraved centrally in a cemented concrete pillar of dimension 54cm x 57cm and 14cm above ground level. The pillar is established in the SE corner of R&B Guest house Premises Alampur mandal, Mahbub  Nagar District of Andra Pr",1809150002,A25QWV4,AndhraPradesh &Telangana Geo-spatial Directorate
45,ALIBAG,18.644143,72.869351,-66.77173,MAHARASHTRA,RAIGARH,ALIBAG,"GCP is situated in the campus of Magnetic Observatory, Alibag","The GCP Pillar (Old GT Station) established as a Magnetic Station by SOI is situated in the Campus of Magnetic Observatory, Alibag. GTS Pillar is 15cm above ground level and having 30cm x 30cm cement concrete platform. Pillar found in good condition and",1722040001,A25WJJV,Maharashtra and Goa Geo-spatial Directorate
46,ALIRAJPUR,22.306351,74.345927,235.26346,MADHYA PRADESH,ALIRAJPUR,ALIRAJPUR,GCP is situated in the premises of Forest Rest House,The Survey reference mark is fixed in the centre of the 30 cm x 30 cm RCC pillar. This pillar is 20 cm above the ground level.  This RCC pillar is fixed at the centre 1 m x 1 m of brick masonry platform. The pillar is established in the Campus of Forest,1331030001,A354P88,Madhya Pradesh Geo-spatial Directorate
47,ALLAGADDA,15.137079,78.495958,91.12681,ANDHRA PRADESH,KURNOOL,ALLAGADDA,"GCP is situated in the campus of MPDO Office, Allagadda.","Cut on top of cemented pillar size 52cm x 52cm x 15cm above ground level. It is situated in the compound of M.P.D.O Office Mandal- Allagadda, Distt.- Kurnool (A.P). The station is about 20m SW side of SW corner of M.P.D.O Office, about 80m S of main entr",2011200001,A25QW4F,AndhraPradesh &Telangana Geo-spatial Directorate
48,ALLAHABAD,25.251747,81.715028,41.61692,UTTAR PRADESH,ALLAHABAD,BARA,"GCP is situated in the campus of Tahsil office,Bara, Allahabad","A small circular brass dot punched in an iron angle, fixed vertically in the center of a concrete cemented pillar at dimensions about 30 cm x 30 cm and about 50 cm above ground level. The GCP pillar is situated in the campus of  Bara Tehsil, Allahabad. I",1065040001,A36737P,Uttar Pradesh Geo-spatial Directorate
49,ALLAKUDI,10.772878,79.05324,-44.35861,TAMIL NADU,THANJAVUR,THANJAVUR,"GCP is situated in the premises of VAO Office , Allakudi","A  concrete cement  GCP Pillar of size 1mx1m was constructed inVAO 0ffice Allakudi village, Taluka- Thanjavur, District Thanjavur. The village is located 7km North of Vallam Town. The station is about 5m E of Govt. Child care center, 15m SE of VAO Office",2922020001,A25GXQ3,"Tamilnadu, Pondicherry and Andaman & Nicobar Island Geo-spatial Directorate"
50,ALLAPALLI,19.443588,80.069983,73.5668,MAHARASHTRA,GADCHIROLI,AHERI,"GCP is situated in the compound of PWD Workshop, Allapalli","A brass dot punched on the top of  an  angle  iron, fixed at the center of a concrete cemented pillar of dimensions about 30cm x 30cm and about 50cm above ground level. The GCP pillar is situated in the compound of PWD Workshop in Village Allapalli.  The",1717030001,A26X2C3,Maharashtra and Goa Geo-spatial Directorate
51,ALLAPALLI,17.829833,80.474886,109.33652,TELANGANA,KHAMMAM,GUNDALA,"GCP is situated in the campus of Zila Parishad High School, Allapalli.",GEODETIC RESEARCH BRANCH The GCP is engraved on a brass plate fixed in the center of the top of the concrete cemented pillar. The dimensions of the pillar are 58cm x 58cm and 20cm above the Ground Level.The pillar is situated in the compound of Zillah Pa,1806020001,A26V2RF,AndhraPradesh &Telangana Geo-spatial Directorate
52,ALLURU,14.680145,80.049142,-80.27836,ANDHRA PRADESH,NELLORE,ALLURU,"GCP is situated in the campus of proposed MRO(Tahsildar Office), Alluru.",The GCP pillar is constructed in the premises of proposed MRO (Tehsildar office) Alluru. It is about 80m SW of compound wall corner near Trijunction of MPDO office road with main road which is leading from Alluru to Kodavaluru. It is about 24m West of An,2014080001,A26P2M2,AndhraPradesh &Telangana Geo-spatial Directorate
53,ALMORA,29.616404,79.630877,1273.65381,UTTARAKHAND,ALMORA,ALMORA,GCP is situated between km stone nos. 34 & 33 on Almora-Ranikhet road,Circle dot engraved on top of a cemented pillar  of dimension 1m × 1m × 1m of water pipe line bend and painted in a red colour. The station is about 9m West from the centre of road and about 6m South of a cemented footpath emanating fromNH-87E road (go,508020001,A35FXJJ,Uttarakhand  Geo-spatial Directorate
54,ALWAR,27.535977,76.613032,215.3112,RAJASTHAN,ALWAR,ALWAR,"GCP is situated in the premises of Circuit House, Alwar","A circular brass dot punched on the top of an angle iron, fixed vertically in the centre and flush  with  the top  level of concrete cemented pillar of dimensions about 30 cm x 30 cm. and about 50 cm above from ground level. The GCP Library pillar situat",912050001,A359RGJ,Rajasthan Geo-spatial Directorate
55,ALWARKURICHI,8.77996,77.392427,-6.76951,TAMIL NADU,TIRUNELVELI,AMBASAMUDRAM,"GCP is situated in the premises of Paramakulyani Higher Secondary School, Alawar Kurichi","A cemented concrete GCP pillar was constructed of dimension 1mx1m at Alwarkurichi village,Taluka Tirunelveli, Distt.-Tirunelveli. It is about 100m E of Paramakulyani Higher Secondary school, about 500m South of Paramakulyani Hospital and about 10m E of d",2932030001,A25CVQ9,"Tamilnadu, Pondicherry and Andaman & Nicobar Island Geo-spatial Directorate"
56,AMARPUR (DASHGHARA),22.959311,88.027984,-41.25338,WEST BENGAL,HUGLI,DHANIAKHALI,"GCP is situated in the campus of Section Office (Irrigation Division), Dashghara","GCP Reference mark fixed with RCC pillar with dimension 1mx1m in the campus of Section office Dashghara (Irrigation Division), Dashghara, Tehsil- Dashghara, Distt.-Hoogli, West Bengal. The station is best approachable from Arambag to Tarakeshwar about 30",1615010001,A364CX2,West Bengal & Sikkim Geo-spatial Directorate
